artist,song_name,duration,listeners,playcount,mbid,album_name,url,tag_ranks,toptags,wiki_summary
radiohead,pyramid song,289000,1098944,9276131,666879c8-2083-4f64-bd7a-9a15bac75962,amnesiac,https://www.last.fm/music/Radiohead/_/Pyramid+Song,"{""experimental"": 30}","['alternative', 'alternative rock', 'radiohead', 'rock', 'beautiful']","Pyramid Song” is a piano-driven piece with vocals and lyrics by Yorke. It also features string orchestrations by band member Jonny Greenwood. The song builds to a climax with the introduction of Phil Selway’s jazz-influenced compound rhythm and the siren-like wails of the Ondes Martenot, an early electronic instrument also played by Jonny. Colin Greenwood plays upright bass rather than his usual electric; O’Brien adds subtle electric guitar to live versions, playing with lots of delay. <a href=""http://www.last.fm/music/Radiohead/_/Pyramid+Song"">Read more on Last.fm</a>."
grizzly bear,two weeks,242000,1079307,10424805,bd2d83e2-c6e4-4d65-b3b5-10f9d6e9009a,veckatimest,https://www.last.fm/music/Grizzly+Bear/_/Two+Weeks,"{""experimental"": 32, ""folk"": 42}","['indie', 'indie rock', 'motherfuckin rabbits ejaculating sunshine', 'beautiful', 'alternative']","""Two Weeks"" is a song by the American indie rock band Grizzly Bear, and the first single from the band's third studio album Veckatimest. Featuring backing vocals from Victoria Legrand, singer and organist for the dream pop duo Beach House, it was released as a single on June 1, 2009. The track met its debut live performance on the Late Show with David Letterman in July 2008.

The video for ""Two Weeks"" was directed by Patrick Daughters. It features the band members sitting on an altar at an empty church <a href=""http://www.last.fm/music/Grizzly+Bear/_/Two+Weeks"">Read more on Last.fm</a>."
radiohead,fitter happier,117000,1072801,6182152,5838f978-0822-4e28-874f-e1511324ec3a,ok computer,https://www.last.fm/music/Radiohead/_/Fitter+Happier,"{""experimental"": 33}","['alternative', 'experimental', 'rock', 'alternative rock', 'radiohead']","Many people mistook the computerized voice on this track for that of physicist Stephen Hawking. The strange voice was, in fact, created by Thom on his Mac computer. He recorded it one night in an isolated area of the rehearsal space that the band had set up. Ed: ""Thom basically had this checklist, like a nineties checklist if you like, and he had written it out. There is a bit of him playing piano, [which was] in the rehearsal room. He was very drunk one night <a href=""http://www.last.fm/music/Radiohead/_/Fitter+Happier"">Read more on Last.fm</a>."
the velvet underground,sunday morning,173000,1059241,8074184,5187616d-baf0-4aff-b650-25ff32ab19d8,sunday morning / femme fatale,https://www.last.fm/music/The+Velvet+Underground/_/Sunday+Morning,"{""experimental"": 36}","['rock', 'classic rock', '60s', 'psychedelic', 'alternative']","“Sunday Morning” is the opening song to The Velvet Underground's debut album, The Velvet Underground & Nico. The song describes the feeling of staying up all Saturday night into Sunday morning. Aptly, Reed & Cale wrote the song after one of those nights at 6 AM on a Sunday morning. 

As Cale remembered in a 2006 interview with Uncut:

""Lou and I had been up all night on crank, as usual, so we decided to visit one of his old Syracuse college pals. <a href=""http://www.last.fm/music/The+Velvet+Underground/_/Sunday+Morning"">Read more on Last.fm</a>."
radiohead,optimistic,292000,1043939,7888741,4d7b8fcb-fafc-4416-9170-752f12e10a2e,kid a,https://www.last.fm/music/Radiohead/_/Optimistic,"{""experimental"": 38}","['alternative', 'alternative rock', 'rock', 'radiohead', 'indie']","""Optimistic"" is the sixth track on the 2000 album Kid A by the band Radiohead.
No singles were released from Kid A, but promos of several songs from the album, including ""Optimistic"", were sent to radio stations. Without an official single specified by the band or label, the guitar-driven ""Optimistic"" became the default track to be picked up by alternative rock stations in the United States and received more airplay than any other track on Kid A. The song hit number 10 on the Billboard modern rock charts <a href=""http://www.last.fm/music/Radiohead/_/Optimistic"">Read more on Last.fm</a>."
radiohead,planet telex,259000,1039205,7192940,a180862e-66a1-4405-a83b-31f0916cd278,the bends,https://www.last.fm/music/Radiohead/_/Planet+Telex,"{""experimental"": 39}","['alternative', 'rock', 'alternative rock', 'radiohead', 'british']","""Planet Xerox"" was this song's original title, but because Xerox was a copyrighted name, Radiohead changed it to ""Planet Telex."" The only song written in the studio during the Bends sessions, it was recorded one night when the band returned to the studio after drinking a lot of wine. Thom did the vocals lying down, completely drunk. This is the most frequently remixed song in Radiohead's roster. <a href=""http://www.last.fm/music/Radiohead/_/Planet+Telex"">Read more on Last.fm</a>."
the velvet underground,femme fatale,159000,1015935,7885792,5020a167-874c-4295-b995-f481314d5e9e,sunday morning / femme fatale,https://www.last.fm/music/The+Velvet+Underground/_/Femme+Fatale,"{""experimental"": 42}","['rock', '60s', 'classic rock', 'psychedelic', 'alternative']","""Femme Fatale"" is a song by American rock band the Velvet Underground from their 1967 debut album ""The Velvet Underground & Nico"", with lead vocals by Nico.

At the request of Andy Warhol, band frontman Lou Reed wrote the song about Warhol superstar Edie Sedgwick. 

According to Reed, Warhol said when asked what he should write about her: ""Oh, don't you think she's a femme fatale, Lou?"", with consequence, Reed wrote ""Femme Fatale"".

The song was recorded with vocals by Nico. Guitarist Sterling Morrison said of the song: <a href=""http://www.last.fm/music/The+Velvet+Underground/_/Femme+Fatale"">Read more on Last.fm</a>."
radiohead,knives out,261000,1001530,8158967,18441305-0d00-4f4f-a932-2e3262e8f793,amnesiac,https://www.last.fm/music/Radiohead/_/Knives+Out,"{""experimental"": 44}","['alternative', 'alternative rock', 'rock', 'radiohead', 'indie']","""Knives Out"" is a song by English alternative rock band Radiohead. The composition features electric and acoustic guitars, complemented by singer Thom Yorke's vocals. It appears on Radiohead's 2001 album Amnesiac, recorded during the same sessions as the previous album Kid A. It was also released as the second Amnesiac single, receiving more radio airplay than the band's other songs of the period. The song reached #13 on the UK singles chart.

Yorke has usually described the song as being about ""cannibalism"". <a href=""http://www.last.fm/music/Radiohead/_/Knives+Out"">Read more on Last.fm</a>."
pink floyd,on the run,353000,1000200,6492744,4018f91a-0dd2-4588-979d-d850a01ee88c,the dark side of the moon,https://www.last.fm/music/Pink+Floyd/_/On+the+Run,"{""experimental"": 46, ""instrumental"": 8}","['Progressive rock', 'classic rock', 'rock', 'psychedelic', 'Psychedelic Rock']","""On the Run"" is the second (or third, if you count speak to me/breathe as 2 tracks) track from British progressive rock band Pink Floyd's 1973 album, The Dark Side of the Moon. It is an instrumental that deals with the pressures of travel (which Rick Wright said would often bring fear of death), and is a VCS3 synthesizer-led piece. When the band performed this song in concert, at the end of it, a model aeroplane would fly from one end of the arena to the other, appearing to crash in a brilliant explosion. <a href=""http://www.last.fm/music/Pink+Floyd/_/On+the+Run"">Read more on Last.fm</a>."
shakira,she wolf,188000,976516,7801843,d34dc769-3c46-45a9-9297-4af248b0a9d4,she wolf,https://www.last.fm/music/Shakira/_/She+Wolf,"{""experimental"": 50}","['pop', 'Shakira', 'dance', 'sexy', 'female vocalists']","""She Wolf"" is Shakira's first single taken from her third English language studio album. The song has a Spanish version (""Loba"") that was used to promote the English album in Spanish-speaking territories.""Loba"" premiered on June 29, 2009 and was played on various radio stations. The song was made available worldwide from July 13 2009, both as a digital download and on CD. The song peaked at #11 on the U.S.  Billboard Hot 100, and went to #1 on the U.S. Hot Dance Club Play chart in Autumn of 2009. <a href=""http://www.last.fm/music/Shakira/_/She+Wolf"">Read more on Last.fm</a>."
vance joy,riptide,204000,1766367,19105111,97c05d07-00d6-4d55-bbb8-b14321d2e4d4,riptide,https://www.last.fm/music/Vance+Joy/_/Riptide,"{""folk"": 1}","['folk', 'indie', 'australian', 'alternative', 'indie folk']","""Riptide"" is a song by Australian singer-songwriter Vance Joy. It was first released as a track on his debut EP ""God Loves You When You're Dancing"", serving as its second single, and is also featured on his debut studio album ""Dream Your Life Away"". The song was written by Joy, who also produced it with drummer Edwin White. The upbeat indie folk song has been lyrically described as a ""coming of age love story"" and is known for its metaphors and pop culture references. <a href=""http://www.last.fm/music/Vance+Joy/_/Riptide"">Read more on Last.fm</a>."
bon iver,skinny love,295000,1591981,19514300,4e46d449-e549-4f53-babb-5fe492a87cc8,"for emma, forever ago",https://www.last.fm/music/Bon+Iver/_/Skinny+Love,"{""folk"": 2}","['folk', 'indie', 'acoustic', 'singer-songwriter', 'beautiful']","""Skinny Love"" is a song written by American musician and songwriter Justin Vernon. It was originally released by indie folk band Bon Iver, of which Vernon is a member, in 2007. A cover version by the British vocalist Birdy was released in 2011. Both versions charted internationally and have been featured in multiple television and film soundtracks. The song has since become a popular tune for various singing competition shows around the anglophone world. <a href=""http://www.last.fm/music/Bon+Iver/_/Skinny+Love"">Read more on Last.fm</a>."
of monsters and men,little talks,266000,1544899,15633422,52ac6312-2390-4f17-a173-e1894724e148,my head is an animal,https://www.last.fm/music/Of+Monsters+and+Men/_/Little+Talks,"{""folk"": 3}","['indie', 'folk', 'alternative', 'indie folk', 'icelandic']","""Little Talks"" is the debut single by the Icelandic indie folk/indie pop rock band Of Monsters and Men. The song was released as the lead single from their debut studio album, ""My Head Is an Animal"". It was also released on the band's EP ""Into the Woods"". It was written by Nanna Bryndís Hilmarsdóttir and Ragnar Þórhallsson, and produced by Aron Þór Arnarsson (all of Of Monsters And Men). The song is written in the key of Bb minor. <a href=""http://www.last.fm/music/Of+Monsters+and+Men/_/Little+Talks"">Read more on Last.fm</a>."
the lumineers,ho hey,161000,1459163,13069845,1243e386-d49c-48b8-aea7-ea14383eb67f,the lumineers,https://www.last.fm/music/The+Lumineers/_/Ho+Hey,"{""folk"": 5}","['indie', 'folk', 'alternative', 'folk rock', 'Love']","""Ho Hey"" is a song by American folk rock band The Lumineers. It was released in 2012 as the lead single from their debut self-titled studio album. The music video was also released on March 11, 2012. ""Ho Hey"" has reached number 3 on the Billboard Hot 100 chart, becoming their first single to do so, as well as their first Top 5 single. It is also their first single to reach Platinum status in the US.

Prior to the single's release, the song was featured on a television commercial for Bing on June 1, 2012. <a href=""http://www.last.fm/music/The+Lumineers/_/Ho+Hey"">Read more on Last.fm</a>."
jeff buckley,hallelujah,413000,1313958,9972628,7e34a170-69ef-45ca-8d3c-938be966351f,grace,https://www.last.fm/music/Jeff+Buckley/_/Hallelujah,"{""folk"": 11}","['singer-songwriter', 'beautiful', 'acoustic', 'cover', 'rock']","""Hallelujah"" is a song by Canadian singer-songwriter Leonard Cohen originally released on his 1984 studio album Various Positions. ""Hallelujah"" has been covered more than 120 times (counting only recorded, not live, versions) and featured in the soundtracks of numerous movies and television shows.

American singer-songwriter Jeff Buckley recorded one of the best-known covers of ""Hallelujah"" for his 1994 studio album, Grace. Buckley, not wholly satisfied with any one take, recorded the song more than twenty times. <a href=""http://www.last.fm/music/Jeff+Buckley/_/Hallelujah"">Read more on Last.fm</a>."
passenger,let her go,252000,1284959,12422213,1682cf55-a9a6-429c-a7f0-ff756781570a,all the little lights,https://www.last.fm/music/Passenger/_/Let+Her+Go,"{""folk"": 13}","['folk', 'acoustic', 'british', 'let her go', '2012']"," <a href=""http://www.last.fm/music/Passenger/_/Let+Her+Go"">Read more on Last.fm</a>."
josé gonzález,heartbeats,160000,1249194,11741804,e9ba89bd-ab94-465a-8c6f-9d37b4b5d2cd,heartbeats,https://www.last.fm/music/Jos%C3%A9+Gonz%C3%A1lez/_/Heartbeats,"{""folk"": 14}","['acoustic', 'chillout', 'indie', 'Mellow', 'singer-songwriter']","This is a gentle acoustic rendition of an original song by The Knife.  <a href=""http://www.last.fm/music/Jos%C3%A9+Gonz%C3%A1lez/_/Heartbeats"">Read more on Last.fm</a>."
fleet foxes,white winter hymnal,147000,1237483,11972877,77abe7b3-be4a-44f1-9d28-61b8f9fc514e,fleet foxes,https://www.last.fm/music/Fleet+Foxes/_/White+Winter+Hymnal,"{""folk"": 16}","['folk', 'indie', 'Mellow', 'beautiful', 'winter']","“White Winter Hymnal“ is the first single from Fleet Foxes' self-titled debut studio album.

Released by European label Bella Union on July 21, 2008, the single was issued on 7"" vinyl as well as digital MP3 format. The B-side is the non-album track, ""Isles."" <a href=""http://www.last.fm/music/Fleet+Foxes/_/White+Winter+Hymnal"">Read more on Last.fm</a>."
buffalo springfield,for what it's worth,153000,1202391,8024195,11db74b6-303b-4a82-94ce-dc77c9143592,retrospective: the best of buffalo springfield,https://www.last.fm/music/Buffalo+Springfield/_/For+What+It%27s+Worth,"{""folk"": 20}","['classic rock', '60s', 'folk rock', 'rock', 'folk']","""For What It's Worth (Stop, Hey What's That Sound)""  is a song written by American musician Stephen Stills. It was performed by Buffalo Springfield, recorded on December 5, 1966, and released as a single on Atco Records on December 23, 1966. The single peaked at number seven on the US Billboard Hot 100 chart. Subsequently, the song has been covered, sampled, and referenced in numerous musical performances. 

Although ""For What It's Worth"" is often considered an anti-war song <a href=""http://www.last.fm/music/Buffalo+Springfield/_/For+What+It%27s+Worth"">Read more on Last.fm</a>."
edward sharpe & the magnetic zeros,home,290000,1165646,10432764,c5d17c63-1e08-43b6-b004-e7809105819d,up from below,https://www.last.fm/music/Edward+Sharpe+&+The+Magnetic+Zeros/_/Home,"{""folk"": 22}","['folk', 'indie folk', 'indie', 'whistling', 'upbeat']"," <a href=""http://www.last.fm/music/Edward+Sharpe+&+The+Magnetic+Zeros/_/Home"">Read more on Last.fm</a>."
dolly parton,jolene,158000,1154188,7410227,0cf427a9-266d-4629-a2c3-2e4ce90534ac,jolene,https://www.last.fm/music/Dolly+Parton/_/Jolene,"{""folk"": 25}","['country', 'female vocalists', 'classic country', 'Dolly Parton', 'folk']","""Jolene"" is a song written and performed by American country music artist Dolly Parton. It was produced by Bob Ferguson and recorded at RCA Studio B in Nashville, Tennessee on May 22, 1973. It was released on October 15, 1973, by RCA Victor, as the first single and title track from her album of the same name. The song was ranked No. 217 on Rolling Stone magazine's list of ""the 500 Greatest Songs of All Time"" in 2004 and, according to Parton, is her most-covered song. <a href=""http://www.last.fm/music/Dolly+Parton/_/Jolene"">Read more on Last.fm</a>."
milky chance,stolen dance,313000,1150600,11293403,9cc331fa-1fba-4c44-a048-3bcdb7bdd3ed,sadnecessary,https://www.last.fm/music/Milky+Chance/_/Stolen+Dance,"{""folk"": 27}","['indie', 'indie folk', 'pop', 'fip', 'indie dance']","""Stolen Dance"" is a song by German duo Milky Chance, released in 2013 in Germany. The single has reached number one in Austria, France, Belgium (Wallonia), Switzerland, Poland, Czech Republic and Hungary. A 4-track Stolen Dance EP (including the single ""Down by the River"") was released by Lichtdicht Records and Republic Records on 9 May 2014. The song also placed at number 4 in Triple J's Hottest 100, 2014. <a href=""http://www.last.fm/music/Milky+Chance/_/Stolen+Dance"">Read more on Last.fm</a>."
neutral milk hotel,in the aeroplane over the sea,239000,1137197,14337897,a6ca91b7-ff8f-4537-b68b-2cc1a1617863,in the aeroplane over the sea,https://www.last.fm/music/Neutral+Milk+Hotel/_/In+the+Aeroplane+Over+the+Sea,"{""folk"": 30}","['indie', 'folk', 'indie rock', 'beautiful', 'neutral milk hotel']","After reading her diary, Jeff Mangum frequently had nightmares about Anne Frank. ""In the Aeroplane Over the Sea"" embodies Mangum's desire to build a time machine and save Frank from her untimely death. <a href=""http://www.last.fm/music/Neutral+Milk+Hotel/_/In+the+Aeroplane+Over+the+Sea"">Read more on Last.fm</a>."
elliott smith,between the bars,141000,1132404,15202285,19e5d62d-f67b-4c21-84f5-1fc4d2350836,either/or,https://www.last.fm/music/Elliott+Smith/_/Between+the+Bars,"{""folk"": 31}","['indie', 'acoustic', 'singer-songwriter', 'Mellow', 'beautiful']","""Between the Bars"" is the fourth track of Elliott Smith's 1997 album, Either/Or. It is written as a short ballad in the key of G Minor. Possibly Smith's most popular song, it is one of three tracks from ""Either/Or"" that was used in the soundtrack of ""Good Will Hunting"". It is also featured in the 2012 indie film ""Stuck in Love"" and in the seventh episode of season two of Rick and Morty. A cover version of the song performed by Chris Garneau was used in Pedro Almodovar's film ""La piel que habito"" (The skin I live in) in 2012. <a href=""http://www.last.fm/music/Elliott+Smith/_/Between+the+Bars"">Read more on Last.fm</a>."
bob dylan,knockin' on heaven's door,389000,1128816,7539286,194b5296-258a-4414-9854-9a520bb32b6e,pat garrett & billy the kid,https://www.last.fm/music/Bob+Dylan/_/Knockin%27+on+Heaven%27s+Door,"{""folk"": 32}","['classic rock', 'folk', 'rock', 'singer-songwriter', 'folk rock']","""Knockin' on Heaven's Door"" is a song by American singer-songwriter Bob Dylan, written for the soundtrack of the 1973 film Pat Garrett and Billy the Kid. Released as a single two months after the film's premiere, it became a worldwide hit, reaching the Top 10 in several countries. The song became one of Dylan's most popular and most covered post-1960s compositions.
It reached #12 on the Billboard Hot 100 in 1973.
It was ranked #190 in 2004 by Rolling Stone magazine, in their 500 Greatest Songs of All Time and #192 in 2010. <a href=""http://www.last.fm/music/Bob+Dylan/_/Knockin%27+on+Heaven%27s+Door"">Read more on Last.fm</a>."
tracy chapman,fast car,296000,1124285,8744305,6731a529-7f3d-4196-b694-9979d20d0f0f,tracy chapman,https://www.last.fm/music/Tracy+Chapman/_/Fast+Car,"{""folk"": 33}","['folk', 'acoustic', 'female vocalists', '80s', 'singer-songwriter']","“Fast Car“ by Tracy Chapman is a story about two lovers who met in the wrong place, and in the wrong time. The character speaking in first person has a hard relationship with their family. The lovers are also poor. The Fast Car Songfacts says: When the then unknown Tracy Chapman was booked to appear down the bill at the Nelson Mandela birthday concert at Wembley Stadium on June 11th 1988, little did she know her appearance would be the catalyst for a career breakthrough. <a href=""http://www.last.fm/music/Tracy+Chapman/_/Fast+Car"">Read more on Last.fm</a>."
america,a horse with no name,250000,1118120,8750455,90141c46-0f99-4435-a90a-af666d6599b7,america,https://www.last.fm/music/America/_/A+Horse+With+No+Name,"{""folk"": 34}","['classic rock', '70s', 'rock', 'soft rock', 'folk']","""A Horse with No Name"" is a song by American folk rock trio America. Written by Dewey Bunnell, it was released on the Warner Bros. label, in late 1971 in Europe and early 1972 in the United States. The song was met with commercial success and topped charts in Canada, Finland, and the United States. It reached number 3 in the UK singles chart. It was certified gold by the Recording Industry Association of America (RIAA) on March 24, 1972. The song was quickly added to a rerelease of the bands' debut studio album <a href=""http://www.last.fm/music/America/_/A+Horse+With+No+Name"">Read more on Last.fm</a>."
bon iver,flume,214000,1113160,11391661,1080ccc2-23c0-47e1-8853-cb3c3cc7624e,"for emma, forever ago",https://www.last.fm/music/Bon+Iver/_/Flume,"{""folk"": 35}","['folk', 'acoustic', 'singer-songwriter', 'indie', 'beautiful']","“Flume” has an eerily interiorized sound, which matches his unsettling similes. “Lump Sum” begins with a choir of Vernons echoing cavernously, which, along with that rhythmically rushing guitar, initiates the listener into the song’s strange space.

The stage name of electronic music producer Flume comes from the title of this song.

From an interview with Bon Iver’s Justin Vernon with Pitchfork:

""'After growing up in a Neil Young/ Bob Dylan/ Indigo Girls/ John Prine/ subjective-songwriter kind of world <a href=""http://www.last.fm/music/Bon+Iver/_/Flume"">Read more on Last.fm</a>."
the mamas & the papas,california dreamin',161000,1107958,7724922,7811af93-81f7-4715-b17b-792fffaeb16f,if you can believe your eyes and ears,https://www.last.fm/music/The+Mamas+&+the+Papas/_/California+Dreamin%27,"{""folk"": 37}","['60s', 'classic rock', 'oldies', 'rock', 'pop']","California Dreamin' is a song by The Mamas & the Papas, first released in 1965. Celebrated as an anthem of West Coast hippy bliss, John Phillips wrote the song in a state of depression in 1964 after a cheerless winter's walk through New York's Central Park. It's a song not of joy, but of immense pain. The pain of wanting to be somewhere else.

The song is #89 in Rolling Stone's list of The 500 Greatest Songs of All Time. <a href=""http://www.last.fm/music/The+Mamas+&+the+Papas/_/California+Dreamin%27"">Read more on Last.fm</a>."
jack johnson,banana pancakes,191000,1104854,7670654,38f529e9-92d5-407a-82e3-0c87b0ae906c,in between dreams,https://www.last.fm/music/Jack+Johnson/_/Banana+Pancakes,"{""folk"": 38}","['acoustic', 'jack johnson', 'chill', 'singer-songwriter', 'Mellow']","“Banana Pancakes” is about Jack and his lover enjoying a rainy day inside by relaxing and eating banana pancakes.

""It’s a wake-up-in-the-morning-and-make-breakfast-with-your-family kind of song. It started when my wife was busy doing something and I wanted to distract her. So I just started playing ‘You hardly even notice/When I try to show you this/Song it’s meant to keep you/From doing what you’re supposed to.’ I’d play her that every time she’d get sidetracked and I wanted to just hang out. <a href=""http://www.last.fm/music/Jack+Johnson/_/Banana+Pancakes"">Read more on Last.fm</a>."
jeff buckley,"lover, you should've come over",402000,1086459,16705180,19ef69ef-bd1f-4891-8dff-9af1dcba0e79,grace,"https://www.last.fm/music/Jeff+Buckley/_/Lover,+You+Should%27ve+Come+Over","{""folk"": 41}","['singer-songwriter', 'rock', 'beautiful', 'Love', 'jeff buckley']","“Lover, You Should've Come Over“ is track seven on Jeff Buckley's album Grace. It is believed to be a song about the ending of the relationship between Buckley and Rebecca Moore.

This is believed to be one of his most powerful and diverse efforts, with a jazzy, soulful, and gospel-like tone to the song. In fact, during the song's climax (""It's Never Over,...""), you can hear gospel-like backing vocals, which in reality are actually Jeff multi-tracking his own voice. <a href=""http://www.last.fm/music/Jeff+Buckley/_/Lover,+You+Should%27ve+Come+Over"">Read more on Last.fm</a>."
johnny cash,ring of fire,156000,1071928,5914086,bfd37140-14fd-497a-a39d-c133011ac244,the legend of johnny cash,https://www.last.fm/music/Johnny+Cash/_/Ring+of+Fire,"{""folk"": 44}","['country', 'Johnny Cash', '60s', 'folk', 'classic rock']","""Ring of Fire"" is a country music song popularized by Johnny Cash and co-written by June Carter (wife of Johnny Cash) and Merle Kilgore. The song was recorded on March 25, 1963 and became the biggest hit of Cash's career, staying at number one on the US charts for seven weeks.

Although the phrase ""Ring of Fire"" sounds somewhat ominous, the term refers to falling in love - which is what June Carter was experiencing with Johnny Cash at the time. Some sources claim that June had seen the phrase <a href=""http://www.last.fm/music/Johnny+Cash/_/Ring+of+Fire"">Read more on Last.fm</a>."
don mclean,american pie,513000,1067904,7307204,208b91ec-3f23-40dd-a815-698061635a34,american pie,https://www.last.fm/music/Don+McLean/_/American+Pie,"{""folk"": 45}","['classic rock', '70s', 'folk', 'singer-songwriter', 'rock']","""American Pie"" is a folk rock song by singer-songwriter Don McLean.

Recorded and released on the American Pie album in 1971, the single was a number-one U.S. hit for four weeks in 1972. A re-release in 1991 did not chart in the U.S., but reached number 12 in the UK. The song is an abstract story surrounding ""The Day the Music Died"" -- the 1959 plane crash that killed Buddy Holly, Ritchie Valens and The Big Bopper (Giles Perry Richardson, Jr.). The <a href=""http://www.last.fm/music/Don+McLean/_/American+Pie"">Read more on Last.fm</a>."
