artist,song_name,duration,listeners,playcount,mbid,album_name,url,tag_ranks,toptags,wiki_summary
the cranberries,linger,274000,1961957,23414622,8bb56929-df81-4474-b363-6e99732cd52b,"everybody else is doing it, so why can't we?",https://www.last.fm/music/The+Cranberries/_/Linger,"{""pop"": 44, ""indie"": 41, ""female vocalists"": 17}","['rock', 'female vocalists', '90s', 'alternative', 'irish']","""Linger"" is a song composed by Irish musicians Dolores O'Riordan and Noel Hogan of the rock band The Cranberries. The song, which has an acoustic arrangement featuring a string section, became the band's first major hit, peaking at #3 in the Republic of Ireland, #8 in the US and #14 in the UK. In the documentary '99 Love Life & Rock 'n' Roll, O'Riordan says that the song is about her first serious kiss.""Linger"" was listed as #86 on the VH1's 100 Greatest Songs of the 90s.  <a href=""http://www.last.fm/music/The+Cranberries/_/Linger"">Read more on Last.fm</a>."
rihanna,don't stop the music,267000,1957809,12839201,a5e848c5-7155-4dfc-931d-df4b01f3a989,good girl gone bad,https://www.last.fm/music/Rihanna/_/Don%27t+Stop+the+Music,"{""pop"": 45, ""female vocalists"": 18}","['dance', 'pop', 'Rihanna', 'rnb', 'female vocalists']","""Don't Stop the Music"" is a song recorded by Barbadian singer Rihanna for her 2007 album ""Good Girl Gone Bad"". It was written by Tawanna Dabney, Michael Jackson, and StarGate. The song was released as the album's fourth single on September 7, 2007 worldwide. ""Don't Stop the Music"" is a dance-pop and techno song that features various rhythmic devices used mainly in hip hop music. The song samples the line, ""Mama-say, mama-sa, ma-ma-ko-ssa"" which is taken from Jackson's 1983 single ""Wanna Be Startin' Somethin'"". <a href=""http://www.last.fm/music/Rihanna/_/Don%27t+Stop+the+Music"">Read more on Last.fm</a>."
mariah carey,all i want for christmas is you,243000,1951509,17161095,a6fab057-cf3a-4456-950e-d3edaf219326,merry christmas,https://www.last.fm/music/Mariah+Carey/_/All+I+Want+for+Christmas+Is+You,"{""pop"": 46, ""female vocalists"": 19}","['christmas', 'pop', 'xmas', 'Mariah Carey', 'female vocalists']","""All I Want for Christmas Is You"" is the lead single from Mariah Carey's first holiday album and fourth studio album, Merry Christmas in 1994. Written and produced by Mariah Carey & Walter Afanasieff.

""All I Want for Christmas Is You"" is an uptempo love song that declares that the narrator does not care about Christmas presents or lights; all she wants for Christmas is to be with her lover.

The song has become established as a Christmas standard. <a href=""http://www.last.fm/music/Mariah+Carey/_/All+I+Want+for+Christmas+Is+You"">Read more on Last.fm</a>."
the cure,friday i'm in love,214000,1946525,17751177,8d9104c6-7d8e-460b-8c3d-2d797f79953d,greatest hits,https://www.last.fm/music/The+Cure/_/Friday+I%27m+in+Love,"{""pop"": 47}","['80s', 'new wave', 'alternative', 'rock', 'The Cure']","""Friday I'm in Love"" written and performed by The Cure is the second single taken from the album ""Wish"". The song reached number 18 on the Billboard Hot 100, giving the band their last American top-40 hit to date.

""Friday I'm in Love"" was nominated for a Grammy Award and won the award for European Viewer's Choice for Best Music Video at the 1992 MTV Video Music Awards. The song was written to be a slower number than its upbeat final rendition. While the track was recorded in D major <a href=""http://www.last.fm/music/The+Cure/_/Friday+I%27m+in+Love"">Read more on Last.fm</a>."
katy perry,last friday night (t.g.i.f.),230000,1947159,15964853,a2b6d3f6-2ab5-4522-9a40-e589fb8f6e02,teenage dream,https://www.last.fm/music/Katy+Perry/_/Last+Friday+Night+(T.G.I.F.),"{""pop"": 48, ""female vocalists"": 20}","['pop', 'dance', 'katy perry', 'female vocalists', 'fun']","""Last Friday Night (T.G.I.F.)"" is a song by American recording artist Katy Perry. The song was written by Perry, Dr. Luke, Max Martin and Bonnie McKee, and was produced by Dr. Luke and Max Martin. It is the fifth single from Perry's third studio album, Teenage Dream by Capitol. ""Last Friday Night (T.G.I.F.)"" peaked at number one on the Billboard Hot 100, making Teenage Dream the second album in history to achieve five #1 singles on the Hot 100 chart, only behind Michael Jackson's ""Bad"". <a href=""http://www.last.fm/music/Katy+Perry/_/Last+Friday+Night+(T.G.I.F.)"">Read more on Last.fm</a>."
lana del rey,video games,281000,1941570,25466856,b9d06b81-b582-46d4-ad41-be47a6961892,born to die - the paradise edition,https://www.last.fm/music/Lana+Del+Rey/_/Video+Games,"{""pop"": 50, ""indie"": 44, ""female vocalists"": 21}","['female vocalists', 'pop', 'indie', 'indie pop', 'Lana Del Rey']","""Video Games"" is the debut single by American singer-songwriter Lana Del Rey for her second studio album and major label debut, Born to Die.

The song is a baroque pop, dream pop, and downtempo ballad where the protagonist who, despite being ignored by her significant other, resolves to love him regardless.

""Video Games"" has received widespread critical acclaim from critics, many of whom praised the uniqueness of Del Rey's vocal performance and the song's cinematic production. <a href=""http://www.last.fm/music/Lana+Del+Rey/_/Video+Games"">Read more on Last.fm</a>."
the strokes,someday,187000,1997413,19756383,e36646d7-dcbf-4b49-b8cf-a6fd5bcd480e,someday,https://www.last.fm/music/The+Strokes/_/Someday,"{""indie"": 39, ""indie rock"": 24}","['indie rock', 'indie', 'rock', 'alternative', 'alternative rock']","Despite having a classic nostalgic theme in the lyrics about ""the good old days"" this is one of The Strokes most upbeat and positive songs. The music video for the song features The Strokes at a bar having fun, as well as a game of the American game show  ""Family Feud"" played between the Strokes and the legendary indie rock act Guided by Voices.

""See, alone we stand, together we fall apart. Yeah, I think I'll be alright. I'm working so I won't have to try so hard. Tables, they turn sometimes. Oh, someday..."" <a href=""http://www.last.fm/music/The+Strokes/_/Someday"">Read more on Last.fm</a>."
the killers,when you were young,220000,1982343,17740318,b38f9ded-8ac3-409e-82c3-187495e4da47,sam's town,https://www.last.fm/music/The+Killers/_/When+You+Were+Young,"{""indie"": 40, ""indie rock"": 25}","['rock', 'indie rock', 'indie', 'alternative', 'alternative rock']","""When You Were Young"" is a song written and performed by Las Vegas-based rock band, The Killers, and is the third track on their second album Sam's Town, released in October 2006.

The song was released as the lead single from that album in September 2006. It has proven to be one of their most successful singles, peaking at #14 on the U.S. Hot 100 (only Mr. Brightside peaked higher on this chart at #10), as well as their only number 1 to date on the U. <a href=""http://www.last.fm/music/The+Killers/_/When+You+Were+Young"">Read more on Last.fm</a>."
kings of leon,use somebody,230000,1942838,17788571,787d77e9-dac1-4ae3-a5f4-0ebba532f362,only by the night,https://www.last.fm/music/Kings+of+Leon/_/Use+Somebody,"{""indie"": 43, ""indie rock"": 26}","['rock', 'indie rock', 'alternative', 'indie', 'Southern Rock']","""Use Somebody"" is the second single from Only by the Night, the fourth studio album by Kings of Leon, released on December 8, 2008.The music video was premiered exclusively on the band's MySpace page on November 4, 2008.

On Sunday, December 7, 2008, Caleb from Kings of Leon said that at about the same time in 2007 when they were touring, they had a fall out, while in Glasgow before their concert on Monday, December 3, 2007. This is when he said ""Use Somebody"" was written <a href=""http://www.last.fm/music/Kings+of+Leon/_/Use+Somebody"">Read more on Last.fm</a>."
the cure,boys don't cry,156000,1922308,19738395,fa1cf5a0-b942-46ed-9ca0-3773fb52cbb6,greatest hits,https://www.last.fm/music/The+Cure/_/Boys+Don%27t+Cry,"{""indie"": 45}","['80s', 'new wave', 'post-punk', 'alternative', 'rock']","""Boys Don't Cry"" was the second single to be released by The Cure, released in June 1979. It was released in the UK as a stand-alone single but was included as the title track on Boys Don't Cry, the American equivalent to Three Imaginary Boys.

Written by Michael Dempsey, Robert Smith, and Lol Tolhurst, the lyrics tell the story of a man who has given up trying to regain the love of a girl that he has lost, and tries to disguise his true emotional state by ""i try to laugh about it, hiding the tears in [his] eyes, 'cause boys don't cry"". <a href=""http://www.last.fm/music/The+Cure/_/Boys+Don%27t+Cry"">Read more on Last.fm</a>."
arctic monkeys,i bet you look good on the dancefloor,176000,1920369,20034802,4fe9a477-643f-4357-ba3b-5a8fbc36a763,i bet you look good on the dancefloor,https://www.last.fm/music/Arctic+Monkeys/_/I+Bet+You+Look+Good+on+the+Dancefloor,"{""indie"": 46, ""indie rock"": 27}","['indie rock', 'indie', 'rock', 'british', 'alternative']","""I Bet You Look Good on the Dancefloor"" is the first single released by Sheffield band the Arctic Monkeys after being signed on Domino Records.

Released on 14 October 2005, it rode the wave of popularity behind the band after a series of sellout gigs across the country, culminating with a gig in front of 2,000 people at the London Astoria. It debuted at Number One on the UK Singles Chart on 23 October. The release of the song and its rise to number one further increased the ever-growing hype surrounding the band <a href=""http://www.last.fm/music/Arctic+Monkeys/_/I+Bet+You+Look+Good+on+the+Dancefloor"">Read more on Last.fm</a>."
coldplay,sparks,227000,1901986,24376553,d99ffc1f-9819-4db1-8677-b13e298bd425,parachutes,https://www.last.fm/music/Coldplay/_/Sparks,"{""indie"": 47, ""indie rock"": 28}","['rock', 'alternative', 'Coldplay', 'Mellow', 'britpop']","“Sparks” is an acoustic song by the British rock band Coldplay. It’s the fourth track off of Coldplay’s debut album, ""Parachutes"".

This acoustic love song is about a person who tries to get someone to remember them again. They go on about their relationship, and how he saw “sparks” of love when they were together. <a href=""http://www.last.fm/music/Coldplay/_/Sparks"">Read more on Last.fm</a>."
radiohead,fake plastic trees,294000,1895515,21624069,1e73e7a6-7378-46e5-97a7-2c299c656a29,the bends,https://www.last.fm/music/Radiohead/_/Fake+Plastic+Trees,"{""indie"": 48, ""indie rock"": 29}","['alternative', 'alternative rock', 'rock', 'radiohead', '90s']","""Fake Plastic Trees"" is a song by the English alternative rock band Radiohead from their second studio album The Bends released in 1995. It was the third single to be released from that album in the UK, but in the US it was the band's first single from the album.

According to band singer Thom Yorke, the song was recorded as the band had just been to see Jeff Buckley play a set at The Garage in London; when they got back into the studio, Yorke recorded the vocals in one take and broke down in tears at the end.  <a href=""http://www.last.fm/music/Radiohead/_/Fake+Plastic+Trees"">Read more on Last.fm</a>."
weezer,buddy holly,159000,1886364,17240585,d615590b-1546-441d-9703-b3cf88487cbd,six hits,https://www.last.fm/music/Weezer/_/Buddy+Holly,"{""indie"": 49, ""indie rock"": 30}","['rock', 'alternative', '90s', 'alternative rock', 'weezer']","""Buddy Holly"" is a song by the rock group Weezer, written by Rivers Cuomo. It was released as the second single from the band's debut album Weezer (The Blue Album) in 1994. The single was released on what would have been Buddy Holly's 58th birthday, had he not been killed in a plane crash along with fellow rock pioneers Ritchie Valens and The Big Bopper on February 3, 1959. The lyrics reference the song's 1950s namesake and actress Mary Tyler Moore. <a href=""http://www.last.fm/music/Weezer/_/Buddy+Holly"">Read more on Last.fm</a>."
hozier,take me to church,241000,1883968,22652350,2b4c7de6-bfaa-456a-9465-247ece2e9052,hozier,https://www.last.fm/music/Hozier/_/Take+Me+to+Church,"{""indie"": 50, ""indie rock"": 31}","['indie', 'soul', 'favorite track right now', '2013', 'indie rock']","The track, ""Take Me To Church"", was released on Sept 16, 2013 by Hozier (full name, Andrew Hozier Byrne) on his debut 4-track EP. The track was written in the attic of his parent's home in Bray, County Wicklow, Ireland following a difficult break-up with his then-girlfriend.

The music video, directed by Brendan Canty, centers on a same-sex relationship between 2 men and a violent homophobic backlash: the video caused an online media storm when it went viral on social media. <a href=""http://www.last.fm/music/Hozier/_/Take+Me+to+Church"">Read more on Last.fm</a>."
carly rae jepsen,call me maybe,193000,1899958,16364196,e760b395-bf53-4aac-afe0-8e3c4bad7423,kiss,https://www.last.fm/music/Carly+Rae+Jepsen/_/Call+Me+Maybe,"{""female vocalists"": 22}","['pop', 'dance', 'female vocalists', 'Canadian', 'Carly Rae Jepsen']","""Call Me Maybe"" is a song by Canadian Juno-nominated artist former Canadian Idol contestant singer-songwriter Carly Rae Jepsen. It was released in September, 2011 but it only met success by the second quarter of 2012. The song peaked at #1 in British, Australian, Canadian and Irish US charts. The Call Me Maybe Songfacts says it was the first Billboard Hot 100 #1 by a Canadian artist in over five years. The previous citizen of Canada to record a chart-topper was Avril Lavigne who reigned with ""Girlfriend"" in May 2007. <a href=""http://www.last.fm/music/Carly+Rae+Jepsen/_/Call+Me+Maybe"">Read more on Last.fm</a>."
adele,someone like you,286000,1856027,17806171,2e26fe2b-9f4d-4efa-96a4-d13de78cacac,21,https://www.last.fm/music/Adele/_/Someone+Like+You,"{""female vocalists"": 23}","['Adele', 'soul', 'piano', 'british', 'female vocals']","""Someone Like You"" is the second single from Adele's second studio album, 21. The song was inspired by a broken relationship with one's life partner, and lyrically speaks of Adele's coming to terms with it. 

""Someone Like You"" received universal critical acclaim, with reviewers choosing it as a highlight of 21 and praised the lyrics, its simple sound and Adele's vocal performance. It became a global success, topping the charts in nineteen countries and reaching the top 10 in various other regions. <a href=""http://www.last.fm/music/Adele/_/Someone+Like+You"">Read more on Last.fm</a>."
nelly furtado,promiscuous,243000,1853519,16377051,18a6f622-fb42-42b4-82cc-3f8dd428547f,promiscuous hit pac,https://www.last.fm/music/Nelly+Furtado/_/Promiscuous,"{""female vocalists"": 24, ""Hip-Hop"": 17}","['pop', 'dance', 'female vocalists', 'Hip-Hop', 'rnb']","""Promiscuous"" (also known as ""Promiscuous Girl"") is a song recorded by singer Nelly Furtado and Timbaland for Furtado's third album, Loose (2006). Furtado, Timothy ""Attitude"" Clayton, Timbaland and Danja wrote the song, and Timbaland and Danja produced it. The song lyrics feature a conversation between a man and woman who call each other a ""promiscuous"" boy or girl.

""Promiscuous"" was released as the first single from Loose in North America in early 2006 <a href=""http://www.last.fm/music/Nelly+Furtado/_/Promiscuous"">Read more on Last.fm</a>."
katy perry,teenage dream,227000,1848400,17635121,8cf81f4a-05fd-4688-bb8c-eb59df2026a0,teenage dream,https://www.last.fm/music/Katy+Perry/_/Teenage+Dream,"{""female vocalists"": 25}","['pop', 'katy perry', 'female vocalists', 'dance', 'teenage dream']","""Teenage Dream"" is a song by American singer Katy Perry. It was released as the second single from her third studio album of the same name on July 23, 2010. This song was written by Perry, Bonnie McKee, Dr. Luke, Max Martin, and Benny Blanco. McKee describes ""Teenage Dream"" as a throwback song to the euphoric feelings of being in love as a teenager while Perry described the song as reminiscent of her youth. Musically, ""Teenage Dream"" is a mid-tempo pop song with a retro sound. <a href=""http://www.last.fm/music/Katy+Perry/_/Teenage+Dream"">Read more on Last.fm</a>."
miley cyrus,party in the u.s.a.,202000,1837464,13352322,c2656d9f-ed39-46a6-ae6c-9a1cadd48ebc,the time of our lives,https://www.last.fm/music/Miley+Cyrus/_/Party+in+the+U.S.A.,"{""female vocalists"": 26}","['pop', 'Miley Cyrus', 'guilty pleasure', 'party in the usa', 'female vocalists']","“Party In The USA“ is the lead single off multi-platinum, American recording artist, Miley Cyrus’ first EP, The Time Of Our Lives. 

The song is one of the few DIAMOND CERTIFIED songs in the world. It was Cyrus’ first Top 3 entry on the Billboard HOT 100 followed by dozens of others.

The EP was being sold exclusively at American Wal-Mart stores in conjunction with the teenage singer's Max Azria clothing line when it was released in 2009. <a href=""http://www.last.fm/music/Miley+Cyrus/_/Party+in+the+U.S.A."">Read more on Last.fm</a>."
amy winehouse,rehab,212000,1792860,12092196,873eba85-b721-4728-be2e-96ce94cccb8b,back to black,https://www.last.fm/music/Amy+Winehouse/_/Rehab,"{""female vocalists"": 28, ""jazz"": 2}","['soul', 'female vocalists', 'jazz', 'Amy Winehouse', 'british']","""Rehab"" is a song about refusing to go to rehab, despite pressure from family, friends and doctors. The narrator describes her struggles with addiction and her choice to fight it outside of a clinical setting. She expresses her strong will and determination to quit drinking, even if it means she ""will have everyone think [she's] on the mend"". Finally, she is adamant about her choice to take a non-traditional approach to recovery and ""won't go, go, go"" to rehab. <a href=""http://www.last.fm/music/Amy+Winehouse/_/Rehab"">Read more on Last.fm</a>."
katy perry,firework,227000,1761764,13758722,9846e3f4-7bb9-49be-8e91-837a5ee5cefb,teenage dream,https://www.last.fm/music/Katy+Perry/_/Firework,"{""female vocalists"": 30}","['pop', 'katy perry', 'female vocalists', 'firework', 'dance']","""Firework"" is a song by American recording artist Katy Perry. The song was written by Perry, Mikkel S. Eriksen, Tor Erik Hermansen, Sandy Wilhelm, Ester Dean, and produced by Stargate and Sandy Vee for Perry's third studio album, Teenage Dream (2010). The song is a self-empowerment anthem with inspirational lyrics, and was considered by Perry as the most important song for her on Teenage Dream.

Perry told Billboard that the inspiration for the song came from an unlikely source. <a href=""http://www.last.fm/music/Katy+Perry/_/Firework"">Read more on Last.fm</a>."
adele,set fire to the rain,277000,1748558,17924918,d1e0a99e-1894-457b-ba6a-985eeef4d0c4,21,https://www.last.fm/music/Adele/_/Set+Fire+to+the+Rain,"{""female vocalists"": 31}","['soul', 'Adele', 'female vocalists', 'pop', 'british']","""Set Fire to the Rain"" is a song performed by english singer-songwriter Adele, released as the third single from her studio album, 21. The song talks about a relationship coming to an end. Girl meets guy, he is wonderful and she falls really quickly. He tells her all of these amazing things, but really they were all a lie and now she is left with a broken heart. He continually tries to play games with her and no matter hard she fights, she will never win. Nothing she can do will fix the relationship. <a href=""http://www.last.fm/music/Adele/_/Set+Fire+to+the+Rain"">Read more on Last.fm</a>."
the cardigans,lovefool,198000,1736156,14444708,45024c74-c06d-423e-adfc-bb9e203091a4,best of,https://www.last.fm/music/The+Cardigans/_/Lovefool,"{""female vocalists"": 33}","['pop', '90s', 'female vocalists', 'rock', 'Love']","""Lovefool"" is a song written by Peter Svensson and Nina Persson for The Cardigans' third studio album, First Band on the Moon. It was released as the album's lead single on 14 September 1996 in the United Kingdom and internationally on 5 October 1996. Following a re-release in 1997, the song found international success, peaking at number two on the UK Singles Chart and achieving moderate success on other European charts. In North America, the song <a href=""http://www.last.fm/music/The+Cardigans/_/Lovefool"">Read more on Last.fm</a>."
nelly furtado,maneater,265000,1734393,16229415,582a2a96-25da-46f0-a916-7ffb0fb7b81e,loose,https://www.last.fm/music/Nelly+Furtado/_/Maneater,"{""female vocalists"": 34}","['pop', 'dance', 'female vocalists', 'Nelly Furtado', 'rnb']","""Maneater"" is a song written by Nelly Furtado, Timothy ""Timbaland"" Mosley, Jim Beanz and Nate ""Danja"" Hills for Furtado's third album, Loose. It was co-produced by Timbaland and Danja and includes influences of 1980s music by artists such as Eurythmics and Hall & Oates. Furtado stated that Hall & Oates' song of the same name was an influence during the writing and recording of the song.

Released as the album's first single in Europe in May 2006, ""Maneater"" became one of Nelly Furtado's most popular singles <a href=""http://www.last.fm/music/Nelly+Furtado/_/Maneater"">Read more on Last.fm</a>."
lana del rey,born to die,321000,1725694,25483615,ac71eb2c-0a25-4f06-acff-13bec69d06e1,born to die,https://www.last.fm/music/Lana+Del+Rey/_/Born+to+Die,"{""female vocalists"": 35}","['indie', 'pop', 'love at first listen', 'indie pop', 'female vocalists']","""Born to Die"" is about making the most of life while accepting that death is inevitable. She contrasts glamorous, wild experiences with the harsh reality of death, singing ""Come and take a walk on the wild side / Let me kiss you hard in the pouring rain / You like your girls insane"" and then pointing out that we all have a limited time here and should make the most of it before it's too late: ""Choose your last words, this is the last time / 'Cause you and I- we were born to die"". <a href=""http://www.last.fm/music/Lana+Del+Rey/_/Born+to+Die"">Read more on Last.fm</a>."
lana del rey,young and beautiful,286000,1717140,20750635,aa9cdaf8-b8f4-42ad-92a3-d0c3d66bfcb1,the dome: summer 2013,https://www.last.fm/music/Lana+Del+Rey/_/Young+and+Beautiful,"{""female vocalists"": 36}","['indie', 'alternative', 'Lana Del Rey', 'female vocalists', 'The Great Gatsby']","""Young and Beautiful"" is a song by Lana Del Rey used for the soundtrack to the drama film ""The Great Gatsby"".

Contemporary music critics lauded the single, calling it ""haunting"" and ""somber"". Lyrically, the song follows a young lover's apprehension about whether love can last.

Del Rey and Nowels received accolades for their songwriting from various music and film awards, including nominations for Best Song Written for Visual Media at the 56th Annual Grammy Awards, and Best Song at the 19th Critics' Choice Awards. <a href=""http://www.last.fm/music/Lana+Del+Rey/_/Young+and+Beautiful"">Read more on Last.fm</a>."
avril lavigne,complicated,244000,1704796,13785988,ef82bf7c-dd8b-4bac-85a8-2211376dc3b4,let go,https://www.last.fm/music/Avril+Lavigne/_/Complicated,"{""female vocalists"": 40, ""punk"": 11}","['pop', 'rock', 'avril lavigne', 'pop rock', 'female vocalists']","“Complicated“ is the debut single by Canadian singer-songwriter Avril Lavigne from her debut album, Let Go. It was released on 11 March 2002 by Arista Records. Lavigne and production team the Matrix (Lauren Christy, Scott Spock, and Graham Edwards) are credited as writers. Production on the song was helmed by the Matrix. According to Lavigne, the song is about being honest with oneself rather than ""putting on a face"".

The single reached number one in Australia <a href=""http://www.last.fm/music/Avril+Lavigne/_/Complicated"">Read more on Last.fm</a>."
britney spears,...baby one more time,211000,1699088,12527261,9aa77fa3-1a7d-4ff9-a5ce-8c3dc072fa52,greatest hits: my prerogative,https://www.last.fm/music/Britney+Spears/_/...Baby+One+More+Time,"{""female vocalists"": 41}","['pop', 'Britney Spears', '90s', 'dance', 'female vocalists']","""...Baby One More Time"" was the lead single from Britney Spears' debut album of the same name, written and co-produced by Max Martin, a prolific Swedish music producer.  The single was released in October of 1998 and quickly climbed to the number one position on the Billboard Hot 100 in 1999, where it stayed for two weeks.  Internationally, the single reached number one in every country that it charted, including the United Kingdom,  France, Australia, and Spain.   <a href=""http://www.last.fm/music/Britney+Spears/_/...Baby+One+More+Time"">Read more on Last.fm</a>."
beyoncé,halo,262000,1679398,12949392,f13db9d7-1c07-4e24-b8c8-4026e511b788,i am... sasha fierce,https://www.last.fm/music/Beyonc%C3%A9/_/Halo,"{""female vocalists"": 42}","['pop', 'rnb', 'beyonce', 'female vocalists', 'soul']","""Halo"" is a song recorded by Beyoncé for her third studio album, I Am... Sasha Fierce. Columbia Records released the song, the album's fourth single, to mainstream radio in the United States on January 20, 2009, and to international markets from February 20. Inspired by Ray LaMontagne's 2004 song ""Shelter"", ""Halo"" was written and composed by Beyoncé, Ryan Tedder and Evan Bogart. It was originally conceived by Tedder and Bogart specifically for Beyoncé, although there was media speculation that it had been intended for Leona Lewis. <a href=""http://www.last.fm/music/Beyonc%C3%A9/_/Halo"">Read more on Last.fm</a>."
