artist,song_name,duration,listeners,playcount,mbid,album_name,url,tag_ranks,toptags,wiki_summary
nirvana,smells like teen spirit,299000,3515927,33320338,0ebe2d92-a11d-4b2b-9922-806383074ed7,nevermind,https://www.last.fm/music/Nirvana/_/Smells+Like+Teen+Spirit,"{""rock"": 1, ""alternative"": 1, ""alternative rock"": 1}","['Grunge', 'rock', 'Nirvana', '90s', 'alternative']","""Smells Like Teen Spirit"" is a song by rock band Nirvana. It is the opening track and lead single from the band's second album ""Nevermind"", released on DGC Records. The unexpected success of the song propelled ""Nevermind"" to the top of several albums charts at the start of 1992, an event often marked as the point when grunge entered the mainstream.

""Smells Like Teen Spirit"" was Nirvana's biggest hit in most countries, charting high on music industry charts around the world in 1991 and 1992 <a href=""http://www.last.fm/music/Nirvana/_/Smells+Like+Teen+Spirit"">Read more on Last.fm</a>."
the killers,mr. brightside,222000,3367222,42026150,37d516ab-d61f-4bcb-9316-7a0b3eb845a8,hot fuss,https://www.last.fm/music/The+Killers/_/Mr.+Brightside,"{""rock"": 2, ""alternative"": 2, ""indie"": 1, ""alternative rock"": 2, ""indie rock"": 1}","['rock', 'indie', 'indie rock', 'alternative', 'alternative rock']","""Mr. Brightside"" is the debut single by Las Vegas-based rock band The Killers. The song is featured on the group's debut album Hot Fuss and was written by Brandon Flowers and Dave Keuning.

It was named ""Song of the Decade"" by UK radio stations Absolute Radio and XFM, and in April 2010 Last.fm revealed that it was the most listened to track since the launch of the online music service, with over 12.2 million plays scrobbled. It held the record until 2020 when BTS broke the record with  ""Boy With Luv"".  <a href=""http://www.last.fm/music/The+Killers/_/Mr.+Brightside"">Read more on Last.fm</a>."
radiohead,creep,239000,3266671,41468886,d11fcceb-dfc5-4d19-b45d-f4e8f6d3eaa6,pablo honey,https://www.last.fm/music/Radiohead/_/Creep,"{""rock"": 3, ""alternative"": 3, ""indie"": 2, ""alternative rock"": 3, ""indie rock"": 2}","['alternative', 'rock', 'alternative rock', 'radiohead', 'indie']","""Creep"" is the first single released by the English alternative rock band Radiohead, and is a track on their debut album Pablo Honey. It was written by the band's singer, Thom Yorke, and released in the United Kingdom initially in September 1992. When it was first given limited release, however, Radio 1 found it ""too depressing"", and removed it from their playlist after airing it only twice. However, it subsequently became one of the band's biggest hits <a href=""http://www.last.fm/music/Radiohead/_/Creep"">Read more on Last.fm</a>."
nirvana,come as you are,219000,3155741,30077767,e05035a3-14ac-4f88-a160-0a144530004e,nevermind,https://www.last.fm/music/Nirvana/_/Come+as+You+Are,"{""rock"": 4, ""alternative"": 4, ""alternative rock"": 4}","['Grunge', 'rock', 'Nirvana', '90s', 'alternative']","""Come as You Are"" is a song by the American grunge band Nirvana, written by frontman Kurt Cobain. It is the third song overall and second single from the band's second album Nevermind. It was the album's second most successful single, and the band's second American Top 40 hit in 1992. After its release as a single in March 1992, ""Come as You Are"" peaked at number 32 on the Billboard Hot 100; it was the band's second and last American Top 40 hit. The single stayed on the chart for 18 weeks. <a href=""http://www.last.fm/music/Nirvana/_/Come+as+You+Are"">Read more on Last.fm</a>."
gorillaz,feel good inc.,222000,3055997,33113139,5660558a-bfa7-416f-99d9-a34ca0a34515,demon days,https://www.last.fm/music/Gorillaz/_/Feel+Good+Inc.,"{""rock"": 5, ""electronic"": 1, ""alternative"": 5, ""pop"": 1, ""indie"": 3, ""alternative rock"": 5, ""Hip-Hop"": 1}","['alternative', 'electronic', 'Hip-Hop', 'rock', 'gorillaz']","""Feel Good Inc."" is a song by British virtual band Gorillaz, featuring American hip-hop group De La Soul. The song was released as the lead single from the band's second studio album ""Demon Days"" on 9 May 2005. The single peaked at No. 2 in the United Kingdom and Europe, and No. 14 in the United States. ""Feel Good Inc."" made the US Billboard year-end top songs chart in 2005 and 2006. It also topped Billboard's Alternative Songs chart in the U.S. for eight consecutive weeks, a first for the band. <a href=""http://www.last.fm/music/Gorillaz/_/Feel+Good+Inc."">Read more on Last.fm</a>."
coldplay,yellow,266000,2953457,29488990,8b5bf478-22f8-4902-a1c1-0db82261db58,parachutes,https://www.last.fm/music/Coldplay/_/Yellow,"{""rock"": 6, ""alternative"": 6, ""pop"": 2, ""indie"": 4, ""alternative rock"": 6}","['rock', 'Coldplay', 'alternative', 'britpop', 'alternative rock']","""Yellow"" is a song by English alternative rock band Coldplay. The band wrote the song and co-produced it with British record producer Ken Nelson for their debut album, Parachutes. The song's lyrics are a reference to band vocalist Chris Martin's unrequited love, and its musicscape is built on a varied instrumentation.

The song was released in June 2000 as the second single off the album, following ""Shiver"", and the lead single in the United States. <a href=""http://www.last.fm/music/Coldplay/_/Yellow"">Read more on Last.fm</a>."
coldplay,viva la vida,241000,2910213,30518386,6cbbb97d-2180-4ba9-97a8-6158b6332bb4,viva la vida or death and all his friends,https://www.last.fm/music/Coldplay/_/Viva+la+Vida,"{""rock"": 7, ""alternative"": 7, ""pop"": 3, ""indie"": 5, ""alternative rock"": 7}","['Coldplay', 'alternative', 'rock', 'alternative rock', 'viva la vida']","""Viva la Vida"" (Spanish: ""Long Live Life"") is the second, Grammy-nominated single released from the English alternative rock band Coldplay 2008 album Viva La Vida or Death and All His Friends. It was initially released only with iTunes Store pre-orders of the album on 7 May 2008, later becoming a download-only single on 25 May 2008. With over 3 million plays, the song earned the number one spot on the Last.fm Best of 2008.

The song was used in an <a href=""http://www.last.fm/music/Coldplay/_/Viva+la+Vida"">Read more on Last.fm</a>."
radiohead,karma police,262000,2743160,32004632,0790ba6c-e0b1-4891-b82f-b4db9a5a927f,ok computer,https://www.last.fm/music/Radiohead/_/Karma+Police,"{""rock"": 8, ""alternative"": 8, ""indie"": 6, ""alternative rock"": 8, ""indie rock"": 3}","['alternative', 'alternative rock', 'rock', 'radiohead', 'indie']","Karma Police is the second single from Radiohead's 1997 album OK Computer. It is Radiohead's most successful song worldwide, apart from Creep. The song is perhaps best recognized for its piano riff, and for its dark bass line.

Karma Police, like several other songs that would make up OK Computer, was debuted live in 1996, when the band briefly supported Alanis Morissette on an American tour. A live version of Karma Police, performed with a Rhodes piano on The Late Show with David Letterman <a href=""http://www.last.fm/music/Radiohead/_/Karma+Police"">Read more on Last.fm</a>."
radiohead,no surprises,228000,2701717,39446772,980a426e-623e-4ea5-98c7-008d037a0508,ok computer,https://www.last.fm/music/Radiohead/_/No+Surprises,"{""rock"": 9, ""alternative"": 9, ""indie"": 7, ""alternative rock"": 9, ""indie rock"": 4}","['alternative', 'alternative rock', 'radiohead', 'rock', 'indie']","""No Surprises"" is a song by the British alternative rock band Radiohead. It was released as the third and final single from the group's 1997 album ""OK Computer"". Accompanied by a music video that featured a single shot of singer Thom Yorke's head in a plastic bubble that filled with water, the single peaked at number four in the United Kingdom.

Radiohead wrote ""No Surprises"" while touring with the band R.E.M. in 1995. ""No Surprises"" was the first song Radiohead recorded on the first day of recording sessions for OK Computer. <a href=""http://www.last.fm/music/Radiohead/_/No+Surprises"">Read more on Last.fm</a>."
linkin park,in the end,216000,2632740,28595488,9d70086c-5d7a-4e7f-b1ed-c53c4b11310f,greatest hits,https://www.last.fm/music/Linkin+Park/_/In+the+End,"{""rock"": 10, ""alternative"": 10, ""metal"": 1, ""alternative rock"": 10}","['rock', 'Nu Metal', 'Linkin Park', 'alternative rock', 'alternative']","""In the End"" is a song written by Linkin Park from their debut album Hybrid Theory. Its lyrics to the song is mainly based on one person's failure. It is considered symbolic of an ending relationship. However it can also be symbolic of a long-lasting friendship's trust between one another that has gone away. It was originally a poem but was deemed good enough to be a song, it is also considered Linkin Park's signature song. ""In The End"" is also one of Linkin Park's most popular songs and it is always performed in every one of their concerts. <a href=""http://www.last.fm/music/Linkin+Park/_/In+the+End"">Read more on Last.fm</a>."
system of a down,chop suey!,210000,2632602,29946690,d758947d-d667-430b-900d-2abb110f63aa,chop suey!,https://www.last.fm/music/System+of+a+Down/_/Chop+Suey%21,"{""rock"": 11, ""alternative"": 11, ""metal"": 2, ""alternative rock"": 11, ""hard rock"": 1}","['alternative metal', 'metal', 'rock', 'System of a Down', 'alternative']","“Chop Suey!“ is the first single from American heavy metal band System of a Down's second album Toxicity. The single was released in September 2001 and earned the band its first Grammy nomination. The song's working title was ""Suicide""; the band members claim the change was not caused by pressure from their record company. The words ""We're rolling Suicide"" can still be heard faintly in the album versions's opening seconds - though this intro is only on certain pressings of the album. <a href=""http://www.last.fm/music/System+of+a+Down/_/Chop+Suey%21"">Read more on Last.fm</a>."
franz ferdinand,take me out,238000,2612872,24030326,11b7c3d2-8a49-4812-95dc-aef93c4cec37,franz ferdinand,https://www.last.fm/music/Franz+Ferdinand/_/Take+Me+Out,"{""rock"": 12, ""alternative"": 12, ""indie"": 8, ""alternative rock"": 12, ""indie rock"": 5}","['indie', 'rock', 'indie rock', 'alternative', 'franz ferdinand']","""Take Me Out"" is the breakthrough hit and second single from Scottish band Franz Ferdinand on their self-titled album. It was released in the United Kingdom on the 12 January 2004 and in the USA on 9 February, both through Domino Records. It was released on CD, 7"" vinyl, and as a DVD single with the video promo and a short interview with the band.

The single reached #3 in the UK Singles Chart. It reached #3 on the US Modern Rock Tracks chart and #66 on the US Billboard Hot 100. <a href=""http://www.last.fm/music/Franz+Ferdinand/_/Take+Me+Out"">Read more on Last.fm</a>."
foo fighters,everlong,250000,2598663,35089380,009f7e7b-5ecf-4cef-a2c1-0f0c736e807e,the colour and the shape,https://www.last.fm/music/Foo+Fighters/_/Everlong,"{""rock"": 13, ""alternative"": 13, ""alternative rock"": 13, ""hard rock"": 2}","['rock', 'alternative rock', 'alternative', 'foo fighters', '90s']","""Everlong"" is the second single from Foo Fighters' second album ""The Colour and the Shape"". It hit #18 in the UK and #3 on the Billboard Modern Rock chart. In 2000, on his first show back from heart surgery, American late night comedian David Letterman introduced the band's performance of the song with ""here's my favorite band, performing my favorite song"".  This appearance made Foo Fighters the first band to perform the same song twice on Letterman's ""The Late Show"" program. <a href=""http://www.last.fm/music/Foo+Fighters/_/Everlong"">Read more on Last.fm</a>."
red hot chili peppers,californication,329000,2567491,22122382,084a24a9-b289-4584-9fb5-1ca0f7500eb3,californication,https://www.last.fm/music/Red+Hot+Chili+Peppers/_/Californication,"{""rock"": 14, ""alternative"": 14, ""alternative rock"": 14}","['rock', 'alternative rock', 'alternative', 'Red Hot Chili Peppers', 'funk']","""Californication"" is a song by American rock band Red Hot Chili Peppers from their seventh album, Californication.

The song reached #69 on the Billboard Hot 100 in the USA, and #16 on the UK charts, and hit #1 on both US Modern Tracks and US Mainstream Rock Tracks. It is notable for its sparse combination of guitar and bass notes in the intro, and its unique music video.

The song is mainly about the dark side of Hollywood. The song opens with the ""Psychic spies from China try to steal your mind's elation. <a href=""http://www.last.fm/music/Red+Hot+Chili+Peppers/_/Californication"">Read more on Last.fm</a>."
the white stripes,seven nation army,232000,2533631,22191140,24cc8311-98fd-423a-bed1-97728f5eabc5,elephant,https://www.last.fm/music/The+White+Stripes/_/Seven+Nation+Army,"{""rock"": 15, ""alternative"": 15, ""indie"": 9, ""alternative rock"": 15, ""indie rock"": 6}","['rock', 'alternative rock', 'alternative', 'indie', 'indie rock']","""Seven Nation Army"" is the first track on the album ""Elephant"" by American alternative rock band The White Stripes. It was released as a single in 2003, and is one of the best-known songs from the band. Seven Nation Army reached #1 on the Modern Rock Tracks for three weeks and won 2004's Grammy Award for Best Rock Song. The song is known for its underlying riff, which plays throughout most of the song. Although it sounds like a bass guitar (an instrument the group had famously never previously used) <a href=""http://www.last.fm/music/The+White+Stripes/_/Seven+Nation+Army"">Read more on Last.fm</a>."
coldplay,the scientist,309000,2531281,24412923,13f5488d-8e41-42d8-9fe9-a5295f1a9a3d,a rush of blood to the head,https://www.last.fm/music/Coldplay/_/The+Scientist,"{""rock"": 16, ""alternative"": 16, ""pop"": 5, ""indie"": 10, ""alternative rock"": 16}","['Coldplay', 'rock', 'alternative', 'britpop', 'british']","Chris Martin wrote ""The Scientist"" after listening to George Harrison's ""All Things Must Pass"". In an interview with Rolling Stone, Martin revealed that while working on the band's second album, A Rush of Blood to the Head, he knew that the album was missing something. One night, during a stay in Liverpool, Martin found an old piano that was out of tune. He wanted to work on George Harrison's song ""Isn't It a Pity"", but he could not manage to do so. <a href=""http://www.last.fm/music/Coldplay/_/The+Scientist"">Read more on Last.fm</a>."
the killers,somebody told me,200000,2476004,22556712,309eb50b-637b-476c-9f23-a589a90432fe,hot fuss,https://www.last.fm/music/The+Killers/_/Somebody+Told+Me,"{""rock"": 17, ""alternative"": 18, ""pop"": 9, ""indie"": 12, ""alternative rock"": 17, ""indie rock"": 7}","['rock', 'indie', 'indie rock', 'alternative', 'The Killers']","""Somebody Told Me"" is a song performed by The Killers. The song is featured on the group's debut album Hot Fuss and was written by Dave Keuning, Ronnie Vannucci Jr., Mark Stoermer and Brandon Flowers.

Lead singer Brandon Flowers refers to this song as ""Our most Vegas-influenced song on the album. Sin city, The Strip. It's where I grew up and of course it affects the songs I write. This song has a lot of sexual energy.""

When The Killers first started out <a href=""http://www.last.fm/music/The+Killers/_/Somebody+Told+Me"">Read more on Last.fm</a>."
linkin park,numb,187000,2464010,26217798,f3217a42-bb14-4191-8c2e-c5e5413467be,meteora,https://www.last.fm/music/Linkin+Park/_/Numb,"{""rock"": 18, ""alternative"": 20, ""metal"": 3, ""alternative rock"": 18}","['rock', 'Nu Metal', 'Linkin Park', 'alternative rock', 'alternative']","""Numb"" is the thirteenth and final song on the 2003 album Meteora by the American nu-metal band Linkin Park. It was released as the album's third single. One of Linkin Park's most well-known and popular tracks, ""Numb"" topped the Billboard Hot Modern Rock Tracks chart for 12 weeks. The song spent six weeks at the top of the chart in 2003 and six weeks in 2004, making it the only song in history to be the most successful song of the year on the Hot Modern Rock Tracks chart for two years. <a href=""http://www.last.fm/music/Linkin+Park/_/Numb"">Read more on Last.fm</a>."
arctic monkeys,do i wanna know?,274000,2441581,36314218,f1e57531-e0df-4b3e-938f-1ae30c5b1a11,am,https://www.last.fm/music/Arctic+Monkeys/_/Do+I+Wanna+Know%3F,"{""rock"": 19, ""alternative"": 21, ""indie"": 14, ""alternative rock"": 19, ""indie rock"": 9}","['indie rock', 'indie', 'alternative', 'arctic monkeys', 'rock']","“Do I Wanna Know?” is the second single from AM. In it, Alex portrays himself as an obsessive lover who is paranoid about the state of his relationship. 

Alex Turner told Q magazine about the song:

""We had this idea for a record where you take the compositional perspective of an R&B producer and apply that to a four-piece rock'n'roll band. Manipulating our instruments to make building blocks for the song in a way I’d imagine Timberland or someone constructs music. <a href=""http://www.last.fm/music/Arctic+Monkeys/_/Do+I+Wanna+Know%3F"">Read more on Last.fm</a>."
red hot chili peppers,under the bridge,264000,2401160,20233193,10d1062a-7275-458f-ad0d-906eeaa22c57,blood sugar sex magik,https://www.last.fm/music/Red+Hot+Chili+Peppers/_/Under+the+Bridge,"{""rock"": 20, ""alternative"": 22, ""alternative rock"": 21}","['rock', 'alternative', 'Red Hot Chili Peppers', '90s', 'alternative rock']","""Under the Bridge"" is a song by the American alternative rock band Red Hot Chili Peppers, released on March 10, 1992 as the second single from the group's fifth studio album Blood Sugar Sex Magik.
Vocalist Anthony Kiedis wrote the lyrics to express his feelings of loneliness and despondency and to reflect on narcotics and their impact on his life.
During rehearsal in April 1991, Kiedis had felt distanced from bandmates Flea and Frusciante. His feeling of loneliness reminded him of his relationship with his former girlfriend <a href=""http://www.last.fm/music/Red+Hot+Chili+Peppers/_/Under+the+Bridge"">Read more on Last.fm</a>."
arctic monkeys,505,305000,2392078,42545572,8dee0224-bcf9-4023-a805-9562bafd3450,favourite worst nightmare,https://www.last.fm/music/Arctic+Monkeys/_/505,"{""rock"": 21, ""alternative"": 24, ""indie"": 16, ""alternative rock"": 22, ""indie rock"": 11}","['indie rock', 'indie', 'british', 'rock', 'alternative']","“505” is one of the songs that marks a turning point in Alex Turner’s songwriting, as he discovers new emotional depths.

The organ sample is taken directly from Ennio Morricone’s soundtrack for the iconic Western, The Good, the Bad and the Ugly, where Angel Eyes enters before the final standoff.

The title could be an allusion to “Flight 505” by The Rolling Stones, with both songs sharing the theme of going somewhere to recapture a feeling or moment… or a person. <a href=""http://www.last.fm/music/Arctic+Monkeys/_/505"">Read more on Last.fm</a>."
kings of leon,sex on fire,203000,2374303,25495490,051caac1-1f67-4733-80b5-62cb32660daa,only by the night,https://www.last.fm/music/Kings+of+Leon/_/Sex+on+Fire,"{""rock"": 22, ""alternative"": 25, ""indie"": 17, ""alternative rock"": 23, ""indie rock"": 12}","['rock', 'indie rock', 'alternative', 'indie', 'i fucking love this song']","""Sex on Fire"" is the first single to be taken from Kings of Leon's fourth studio album Only by the Night and as of September 2009, the second most-downloaded digital single ever in the United Kingdom.
The song gave Kings of Leon their first number-one single in Australia, Finland, Ireland  and United Kingdom, charting at the top-spot in the UK Singles Chart on digital downloads alone, before its physical release. It has also gained significant popularity in the United States <a href=""http://www.last.fm/music/Kings+of+Leon/_/Sex+on+Fire"">Read more on Last.fm</a>."
oasis,wonderwall,261000,2370404,19704155,31623cce-9717-4513-9d83-1b5d04e44f9b,(what's the story) morning glory?,https://www.last.fm/music/Oasis/_/Wonderwall,"{""rock"": 23, ""alternative"": 26, ""pop"": 14, ""indie"": 18, ""alternative rock"": 24}","['rock', 'britpop', '90s', 'alternative', 'oasis']","""Wonderwall"" is a song by British rock band Oasis, written by the band's guitarist and chief songwriter Noel Gallagher. Released as the third single from (What's the Story) Morning Glory? in October 1995, ""Wonderwall"" peaked at number two in the UK Singles Charts and proved to be their American breakthrough, reaching number eight on the Hot 100 and giving them their only top-ten hit in the US . ""Wonderwall"" is perhaps their most popular song, despite <a href=""http://www.last.fm/music/Oasis/_/Wonderwall"">Read more on Last.fm</a>."
coldplay,clocks,307000,2361124,18913576,ec87fef2-84cd-41b3-8642-38ce1b6962a6,a rush of blood to the head,https://www.last.fm/music/Coldplay/_/Clocks,"{""rock"": 24, ""alternative"": 28, ""pop"": 15, ""indie"": 20, ""alternative rock"": 25}","['rock', 'Coldplay', 'alternative', 'britpop', 'alternative rock']","""Clocks"" emerged in conception during the late stages into the production of Coldplay's second album, A Rush of Blood to the Head. The band's vocalist, Chris Martin, came in studio late one night. A riff popped  up in Martin's mind and wrote it on the  piano. Martin presented the riff to the band's guitarist, Jonny Buckland, who then added guitar chords on the basic track.

During the writing of ""Clocks"", the band had already made 10 songs for the album. <a href=""http://www.last.fm/music/Coldplay/_/Clocks"">Read more on Last.fm</a>."
nirvana,lithium,110000,2342962,19223334,3f5647db-6f12-4c36-94ea-2d06f2c7e8f9,nevermind,https://www.last.fm/music/Nirvana/_/Lithium,"{""rock"": 25, ""alternative"": 29, ""alternative rock"": 26}","['Grunge', 'rock', '90s', 'Nirvana', 'alternative']","""Lithium"" is a song by the American grunge band Nirvana, written by frontman Kurt Cobain. The name of the song is often attributed to the usage of lithium salts as mood stabilizers. Because of this the lyrics are often interpreted as describing bipolar disorder. Cobain is said to have had bipolar disorder, which may have led to the writing of the song ""Lithium"". Still, there is much disagreement about the exact meaning and interpretation of it.

In the Nevermind press kit <a href=""http://www.last.fm/music/Nirvana/_/Lithium"">Read more on Last.fm</a>."
muse,supermassive black hole,209000,2327453,25543856,11c01f77-0931-486e-b31c-1278b4f4441a,black holes and revelations,https://www.last.fm/music/Muse/_/Supermassive+Black+Hole,"{""rock"": 26, ""alternative"": 30, ""indie"": 21, ""alternative rock"": 27, ""indie rock"": 13}","['alternative rock', 'rock', 'alternative', 'Muse', 'british']","""Supermassive Black Hole"" is the first single from Black Holes and Revelations, released on 19 June 2006. Its B-side is Crying Shame. The song has been available online since 9 May following a radio premiere the previous day. The single reached #4 in the UK Singles Chart, making it the highest charting single by the band to date. The track was mixed at Townhouse Studios, London. It was released as the third U.S. single on April 23, 2007.

Influences <a href=""http://www.last.fm/music/Muse/_/Supermassive+Black+Hole"">Read more on Last.fm</a>."
tears for fears,everybody wants to rule the world,253000,2269067,24084075,e4b347be-ecb2-44ff-aaa8-3d4c517d7ea5,songs from the big chair,https://www.last.fm/music/Tears+for+Fears/_/Everybody+Wants+to+Rule+the+World,"{""rock"": 28, ""pop"": 18}","['80s', 'pop', 'new wave', 'Tears for Fears', 'rock']","""Everybody Wants to Rule the World"" is a song by the English New Wave band Tears for Fears.

It was the band's ninth single release in the United Kingdom (the third from their second LP: Songs from the Big Chair) and seventh UK Top 40 chart hit, peaking at number two in April 1985.

 In the U.S., it was the lead single from the album and gave the band their first Billboard Hot 100 number-one hit on 8 June 1985, remaining there for two weeks. It also <a href=""http://www.last.fm/music/Tears+for+Fears/_/Everybody+Wants+to+Rule+the+World"">Read more on Last.fm</a>."
katy perry,i kissed a girl,178000,2264846,16619562,9ed869d7-4297-4033-b47a-afe9476eebf2,one of the boys,https://www.last.fm/music/Katy+Perry/_/I+Kissed+a+Girl,"{""rock"": 29, ""pop"": 19, ""female vocalists"": 6}","['pop', 'female vocalists', 'katy perry', 'pop rock', 'rock']","""I Kissed a Girl"" is a two-time VMA's nominated pop song, and the lead single from Katy Perry's debut album One of the Boys written by Katy Perry and Cathy Dennis and produced by Dr. Luke. Perry says it is ""about the magical beauty of a woman."" On June 26, 2008, the song topped the Billboard Hot 100 chart, becoming the 1000th chart-topper of the Rock Era. Along with the United States, it has also topped the charts in many other countries around the world, including Canada, Sweden, Australia, United Kingdom, New Zealand, Germany and Ireland. <a href=""http://www.last.fm/music/Katy+Perry/_/I+Kissed+a+Girl"">Read more on Last.fm</a>."
red hot chili peppers,scar tissue,215000,2262604,20506074,3ec5cb52-7dde-4d11-aec2-1c1af8fc559c,greatest hits,https://www.last.fm/music/Red+Hot+Chili+Peppers/_/Scar+Tissue,"{""rock"": 30, ""alternative"": 31, ""alternative rock"": 28}","['rock', 'alternative rock', 'alternative', 'Red Hot Chili Peppers', 'funk']","""Scar Tissue"" is the first single from American rock band Red Hot Chili Peppers' seventh studio album, Californication (1999).

The first single from the album Californication. It was the first single to feature the return of guitarist John Frusciante, who left the band in 1992 after the release of their breakthrough album Blood Sugar Sex Magik. He returned to the band for the recording of Californication.

The song spent 16 consecutive weeks atop <a href=""http://www.last.fm/music/Red+Hot+Chili+Peppers/_/Scar+Tissue"">Read more on Last.fm</a>."
